{
  "$schema": "https://json-schema.org/draft/2020-12/schema",
  "$id": "https://github.com/lyricalmyricalbooks/LMB-PLATFORM/profile/shop-profile.schema.json",
  "title": "Shop profile (public part)",
  "description": "What differs between shops and is safe for anyone to read. Hosting serves it as /shop-profile.js; the shop and the stockroom read it when the page opens. Plan, test mode, secret keys and sender domain are NOT here: they live in server-only documents and the platform registry. The payment form's public ids are (payments): the page needs them to show the card form.",
  "type": "object",
  "additionalProperties": false,
  "required": ["version", "shopId", "firebase", "functionsRegion", "siteUrl", "apps"],
  "properties": {
    "version": { "const": 1, "description": "Format version. Bump only with a change both apps can read." },
    "shopId": {
      "type": "string",
      "pattern": "^[a-z][a-z0-9-]{2,29}$",
      "description": "The shop's id in the registry, also the project id suffix."
    },
    "firebase": {
      "type": "object",
      "additionalProperties": false,
      "required": ["apiKey", "authDomain", "projectId", "storageBucket", "messagingSenderId", "appId"],
      "description": "The Firebase web settings. Not secret.",
      "properties": {
        "apiKey": { "type": "string", "minLength": 1 },
        "authDomain": { "type": "string", "minLength": 1 },
        "projectId": { "type": "string", "pattern": "^[a-z][a-z0-9-]{4,28}[a-z0-9]$" },
        "storageBucket": { "type": "string", "minLength": 1 },
        "messagingSenderId": { "type": "string", "pattern": "^[0-9]+$" },
        "appId": { "type": "string", "minLength": 1 },
        "databaseURL": {
          "type": "string",
          "pattern": "^https://[^/\\s]+/?$",
          "description": "The stockroom's Realtime Database address. Missing: the project's default database address."
        }
      }
    },
    "functionsRegion": { "type": "string", "pattern": "^[a-z]+-[a-z]+[0-9]$" },
    "siteUrl": { "type": "string", "pattern": "^https://[^/\\s]+$", "description": "The shop's address, no trailing slash." },
    "appCheckSiteKey": { "type": "string", "description": "Bot-protection site key. Empty or missing: the app's build setting is used." },
    "apps": {
      "type": "object",
      "additionalProperties": false,
      "required": ["shop", "stockroom"],
      "properties": {
        "shop": { "type": "boolean" },
        "stockroom": { "type": "boolean" }
      }
    },
    "stockroom": {
      "type": "object",
      "additionalProperties": false,
      "required": ["firestoreDatabase", "storageBucket"],
      "description": "Where the stockroom keeps its data inside the shop's project (plan 1.20): its own named Firestore database and its own storage bucket, each with its own rules. Missing: the project's default database and bucket (a stockroom in a project of its own).",
      "properties": {
        "firestoreDatabase": { "type": "string", "pattern": "^[a-z][a-z0-9-]{2,61}[a-z0-9]$", "description": "The named Firestore database: \"stockroom\" for every shop setup makes." },
        "storageBucket": { "type": "string", "pattern": "^[a-z0-9][a-z0-9._-]{1,220}[a-z0-9]$", "description": "The stockroom's storage bucket: \"<project id>-stockroom\"." }
      }
    },
    "switches": {
      "type": "object",
      "additionalProperties": false,
      "description": "Features one press needed once that a new shop doesn't. Each is on only when true; missing means off. Setup writes all three as false.",
      "properties": {
        "legacyStockroomSignIn": { "type": "boolean", "description": "The shop's admin sign-in also signs into a separate stockroom project." },
        "githubPagesForwarding": { "type": "boolean", "description": "An old GitHub Pages address forwards visitors (and their bag) to the shop." },
        "gmailReceiptFinder": { "type": "boolean", "description": "The stockroom's Gmail receipt finder and Gmail import." }
      }
    },
    "payments": {
      "type": "object",
      "additionalProperties": false,
      "required": ["provider", "mode"],
      "description": "How the shop takes card payments, and the public ids its payment form needs. Missing: the shop's own keys in its settings (mode own). Setup writes it once the press's account exists (step 13). The server never trusts it: the platform's payment service acts only on the account the registry lists for the shop.",
      "properties": {
        "provider": { "type": "string", "pattern": "^(stripe|square)$", "description": "Which provider takes the payments. The shop's server reads the same choice from SHOP_PAYMENT_PROVIDER." },
        "mode": { "type": "string", "pattern": "^(own|platform)$", "description": "own: the shop's own keys, in its settings. platform: through the platform's payment service, on the press's connected account." },
        "stripe": {
          "type": "object",
          "additionalProperties": false,
          "required": ["accountId"],
          "description": "Stripe in platform mode: the press's connected account and the platform's publishable keys, public by design.",
          "properties": {
            "accountId": { "type": "string", "pattern": "^acct_[A-Za-z0-9]+$" },
            "publishableKey": { "type": "string", "pattern": "^pk_live_[A-Za-z0-9]+$" },
            "testPublishableKey": { "type": "string", "pattern": "^pk_test_[A-Za-z0-9]+$" }
          }
        }
      }
    }
  }
}
