{
  "version": 1,
  "shopId": "lmb-test-shop",
  "firebase": {
    "apiKey": "AIzaTestShopKeyNotReal00000000000000000",
    "authDomain": "lmb-test-shop.firebaseapp.com",
    "projectId": "lmb-test-shop",
    "storageBucket": "lmb-test-shop.firebasestorage.app",
    "messagingSenderId": "100000000001",
    "appId": "1:100000000001:web:0000000000000000000001"
  },
  "functionsRegion": "us-central1",
  "siteUrl": "https://lmb-test-shop.web.app",
  "apps": {
    "shop": true,
    "stockroom": true
  }
}
