{
  "version": 1,
  "shopId": "lyricalmyrical",
  "firebase": {
    "apiKey": "AIzaSyB9V866zhYfSoXplpzK1oaK7dTuXV7yDxA",
    "authDomain": "lyricalmyrical-web-v2.firebaseapp.com",
    "projectId": "lyricalmyrical-web-v2",
    "storageBucket": "lyricalmyrical-web-v2.firebasestorage.app",
    "messagingSenderId": "248894589273",
    "appId": "1:248894589273:web:8bf4b06399c0931f1b6448"
  },
  "functionsRegion": "us-central1",
  "siteUrl": "https://lyricalmyrical-web-v2.web.app",
  "apps": { "shop": true, "stockroom": true }
}
